projection_group,tokens,latency_ms,latency_minutes,provider_calls,final_judge_packets,turn_judge_packets,final_judge_scores_expected,turn_judge_scores_expected_if_enabled,condition_count,status,note
projection_basis,,,,,,,,,,,Token and latency projections use only the current-lock D1 HoloFactory frontier run. Legacy/historical/mini-error runs are excluded from proof analytics.
frontier_current_lock_d1,577728,1895126,31.585,30,3,18,,,,,
frontier_current_lock_5_domain_projection,2888640,9475630,157.925,150,15,90,30,360,,,
current_frontier_judging_gap,,,,,,,,,,,Only outside-DNA proof-credit final judging is counted here.
mini_current_lock_d1,,,,,,,,,,pending_not_scored,No current-lock HoloFactory mini live proof run is scored. Legacy mini/error attempts are excluded.
